{
  "schemaVersion": "1.0.0",
  "runtimeVersion": "1.2.0",
  "workflowVersion": "2.4.0",
  "installedAt": "2026-10-12T18:29:52.961Z",
  "updatedAt": "2026-10-12T18:29:52.961Z",
  "sourceCommit": "638d7aaf8ed02574fde0af754731f6aadd8c7894",
  "manifestSha256": "0e028d67945819bf06ac19d853d173f63f9c86f390e6023c3834c13cf7131d43",
  "distributionSha256": "b37d01a768ebce61c3363401571f6026fdf44535b3a680656658b6f9190c3e71",
  "lastBackup": null,
  "adoptedBackup": null,
  "adoptedFiles": [],
  "targetSymlinks": [],
  "managedFiles": [
    {
      "path": ".github/agents/impeccable-asset-producer.agent.md",
      "sha256": "1038bab35091c94b8b521e56b094987c1f3f022ec66eaa525b740167047225c3",
      "bytes": 9761
    },
    {
      "path": ".github/agents/impeccable-documenter.agent.md",
      "sha256": "3ca413fa64f3e5939bada4fb8f6980e6fceb79f6e76163d08bedac45d8a2782d",
      "bytes": 3104
    },
    {
      "path": ".github/agents/impeccable-finish-reviewer.agent.md",
      "sha256": "add305dbb95f2e626c01f582e07632b03410dc4a2d3460efb60477b06ad4cc85",
      "bytes": 8932
    },
    {
      "path": ".github/agents/impeccable-manual-edit-applier.agent.md",
      "sha256": "edc2fa5ff5935b92a87bae2a76405d03c4e57f203e6862b932035152ecd5835f",
      "bytes": 6883
    },
    {
      "path": ".github/hooks/impeccable.json",
      "sha256": "3e598e845f3218e6796438db28f095b02166e5bc2a4a9b76b9ebfd5bf630a6a1",
      "bytes": 473
    },
    {
      "path": ".github/skills/impeccable/reference/adapt.md",
      "sha256": "ec58806f16fc7ba29bccef08f2e158cd00be077ce05d45e943a59bd26dc6dc55",
      "bytes": 10307
    },
    {
      "path": ".github/skills/impeccable/reference/adapt.native.md",
      "sha256": "17c583cf8ad41266ea1e787b666b9d91fe13469d3d0f6af57c08e0146f9b17ac",
      "bytes": 3910
    },
    {
      "path": ".github/skills/impeccable/reference/android.md",
      "sha256": "dacaaf57fe334fb1a02ddb4da5217c78f4e154ac9e6b760d2cc69cceaed0eac4",
      "bytes": 3253
    },
    {
      "path": ".github/skills/impeccable/reference/animate.md",
      "sha256": "e86a01920e31b1f7d3d2d1961c2470bbe8db9f3ebfe5f0985fe004ca64f3a3cc",
      "bytes": 4795
    },
    {
      "path": ".github/skills/impeccable/reference/audit.md",
      "sha256": "57402ef6fd9d0745f8c60d778f77da83a8b16edf751fa1013598a0f6e5f0f541",
      "bytes": 7873
    },
    {
      "path": ".github/skills/impeccable/reference/audit.native.md",
      "sha256": "010ecb4ef79d6e063280791cd2d5e6a689f4f7a3d66c60d7d43f04e7b2067966",
      "bytes": 8357
    },
    {
      "path": ".github/skills/impeccable/reference/bolder.md",
      "sha256": "ee21db98b69ccc6b071ff5f5736310df54cfac975d950f5749cf00d7200fe96c",
      "bytes": 3213
    },
    {
      "path": ".github/skills/impeccable/reference/clarify.md",
      "sha256": "6c382f8283756e8a693d832b750f7e4cbff1ca5bdcc3825b2b4ef4da9f21876a",
      "bytes": 4590
    },
    {
      "path": ".github/skills/impeccable/reference/colorize.md",
      "sha256": "d1fbd55074abb2251bdaa03749d34acc42c38e46e47549f18f5848df57d43c42",
      "bytes": 4537
    },
    {
      "path": ".github/skills/impeccable/reference/craft-floor.md",
      "sha256": "f45643e285aad99e64c55f3427fad5b81e08b0f848ff6b7554c8fe94e0ba0d9f",
      "bytes": 3811
    },
    {
      "path": ".github/skills/impeccable/reference/craft.md",
      "sha256": "9205e222bc6565b37fb504ceec93233c2d2a456802b69d16e6b1c44723907c4c",
      "bytes": 555
    },
    {
      "path": ".github/skills/impeccable/reference/critique.md",
      "sha256": "9df18e41b69186fd0d084ef014c3a3d589142062369d888a1689f9e516f8fa44",
      "bytes": 39961
    },
    {
      "path": ".github/skills/impeccable/reference/degraded/asset-producer.md",
      "sha256": "69419be8287b2fdfaf3d4126131ec01739733b3801d55d7e30a06f0d0bda12e5",
      "bytes": 10054
    },
    {
      "path": ".github/skills/impeccable/reference/degraded/documenter.md",
      "sha256": "97a09e350c383cb2f6bba027b83bedffd12a23b1b439ad4a045a48953eb19365",
      "bytes": 3365
    },
    {
      "path": ".github/skills/impeccable/reference/degraded/finish-reviewer.md",
      "sha256": "8b44ea009ac73e44a93005f4d5501b551a382889c7c99929ebd6bb6a6b59924f",
      "bytes": 9170
    },
    {
      "path": ".github/skills/impeccable/reference/degraded/manual-edit-applier.md",
      "sha256": "9aae8d5bfb72a8cf3473dca74d5046e28002c0b43a7f9b3c14cd0f1a06c8deb4",
      "bytes": 7182
    },
    {
      "path": ".github/skills/impeccable/reference/delight.md",
      "sha256": "56500b1f9d2fcec8324d7f448d813048b5831a46d3feeb1055bd3eb17ec3660f",
      "bytes": 3716
    },
    {
      "path": ".github/skills/impeccable/reference/distill.md",
      "sha256": "0ff7dfd49b96802801fce06c024e8b0d1535a90d23f6889f1c3ec148fdf6365c",
      "bytes": 5615
    },
    {
      "path": ".github/skills/impeccable/reference/doctor.md",
      "sha256": "dd783d981f84c8074ac1d48533ef50de0da4d01d63ef56db5fc094c6df5edee8",
      "bytes": 4752
    },
    {
      "path": ".github/skills/impeccable/reference/document.md",
      "sha256": "2744b2e859865e143770a94b6a584129fdc708d0c54ea78c6d93ef670f77c137",
      "bytes": 27427
    },
    {
      "path": ".github/skills/impeccable/reference/extract.md",
      "sha256": "346a3ed037de1d6d9194fcf079b94d4f5508f1cff12a9b2a29fdf2c2995610a2",
      "bytes": 3343
    },
    {
      "path": ".github/skills/impeccable/reference/harden.md",
      "sha256": "8a1c872773996dfa1c1eb765ac7ed8e8d41f99d4f12f090b4725b694e85eaa62",
      "bytes": 8539
    },
    {
      "path": ".github/skills/impeccable/reference/hooks.md",
      "sha256": "698f15e665639e0e806350fd14fe578af882c5d383c8415a1734664214895aac",
      "bytes": 11871
    },
    {
      "path": ".github/skills/impeccable/reference/init.md",
      "sha256": "40de144e817a7d8b34542a89edfb7ea9947e3ae673fd9e2079068d00def2a579",
      "bytes": 8782
    },
    {
      "path": ".github/skills/impeccable/reference/ios.md",
      "sha256": "07131918b18ce50dbd62fa20bb519d7a0b4a36c798f0e5332522b75cbc7d0574",
      "bytes": 2975
    },
    {
      "path": ".github/skills/impeccable/reference/layout.md",
      "sha256": "51d645ce054f573c15bffe8efbf08fe67f197d73fdd78e33d69658d70c97e539",
      "bytes": 5159
    },
    {
      "path": ".github/skills/impeccable/reference/live-setup.md",
      "sha256": "148e7cd9d88e14588079993af502a0d2351c7fc4d8e6dfbb68074e63677ed52c",
      "bytes": 7422
    },
    {
      "path": ".github/skills/impeccable/reference/live.md",
      "sha256": "570c9c1c30ce4df3ae495fa718f8056d9ba846cfe85ad1085de28b9483a1bd58",
      "bytes": 35596
    },
    {
      "path": ".github/skills/impeccable/reference/new-work.md",
      "sha256": "0dbea5c0aef596ea4e4456956e4f1d98c398f67ac5992a584864ca5440b8fe01",
      "bytes": 30528
    },
    {
      "path": ".github/skills/impeccable/reference/onboard.md",
      "sha256": "9a2c08ee2516d2ee87129e7ebe6a0895f9990c9852d1f6fa7e70be9a6a88a659",
      "bytes": 7740
    },
    {
      "path": ".github/skills/impeccable/reference/operate.md",
      "sha256": "a9d2203acd45ca33a13d5c68b02b23ed512425ac15f0e8438318ed124b43729d",
      "bytes": 4145
    },
    {
      "path": ".github/skills/impeccable/reference/optimize.md",
      "sha256": "6d368b679a0ed1815812815de65863b5840d419589dfbda06224c01149240287",
      "bytes": 7614
    },
    {
      "path": ".github/skills/impeccable/reference/overdrive.md",
      "sha256": "b933a5a955c6c6f8662f1e0d10efd5fa68ef0a0e6b9b9c6911635d5c4aa101ad",
      "bytes": 8817
    },
    {
      "path": ".github/skills/impeccable/reference/polish.md",
      "sha256": "d56eb0518dd4589ee8e64167d4952790d2fb7b267f485a7d8ce8e0c5e18a3e21",
      "bytes": 5200
    },
    {
      "path": ".github/skills/impeccable/reference/quieter.md",
      "sha256": "9ed70ee30cf4c8667e9cb51db531dc3f78afde0c5b718af5c00de861d3201538",
      "bytes": 4850
    },
    {
      "path": ".github/skills/impeccable/reference/routing.md",
      "sha256": "cf834ff9a85dcd6f27911729ba03706ee917afd4edd284c481511a375f411e08",
      "bytes": 2915
    },
    {
      "path": ".github/skills/impeccable/reference/shape.md",
      "sha256": "a55f016c046cb6a27c55bd7f346375aeb506a755c4fbca19a5f92dbd42309c23",
      "bytes": 3547
    },
    {
      "path": ".github/skills/impeccable/reference/typeset.md",
      "sha256": "7b753e827a0ee2d6458af18f17b273b27c4ea4125326540579b2bb9b47dbb852",
      "bytes": 5254
    },
    {
      "path": ".github/skills/impeccable/reference/visualize.md",
      "sha256": "66620af273f3e9a97949dd89ec7e110363798f2ab8c48efa8fe743a62690099e",
      "bytes": 12410
    },
    {
      "path": ".github/skills/impeccable/scripts/command-metadata.json",
      "sha256": "6bdbc3f745ceee15e10b050f109ce42bbeb53ab3c3b5239257de1d596654dee7",
      "bytes": 7934
    },
    {
      "path": ".github/skills/impeccable/scripts/concept-seed.mjs",
      "sha256": "d9422308269c10b887a5b396effa7471f3b89b07d2be4b77ffd97649d725a40a",
      "bytes": 27973
    },
    {
      "path": ".github/skills/impeccable/scripts/context-signals.mjs",
      "sha256": "04abe8167c5c9eb36eaa57d4cd059a2f6bd1044abb6e1f20f5797e0a8d66993d",
      "bytes": 14376
    },
    {
      "path": ".github/skills/impeccable/scripts/context.mjs",
      "sha256": "fbf052c974ee222db4ecb0030530b7dad6b741cf66d0c2eba617437d6c648c66",
      "bytes": 60893
    },
    {
      "path": ".github/skills/impeccable/scripts/critique-storage.mjs",
      "sha256": "ecafe838f5596a8da37d8b995d51d0954e26f98dec3608afd6cc20dcea1603f6",
      "bytes": 8128
    },
    {
      "path": ".github/skills/impeccable/scripts/detect-csp.mjs",
      "sha256": "2d80520bef13cb93107699714bc0d2be5a2787a9aa079ecec91b94508a8125a4",
      "bytes": 6761
    },
    {
      "path": ".github/skills/impeccable/scripts/detect.mjs",
      "sha256": "f5dfd05ca1e314acd8ed79c6301a20a1b844f2eb6691bd63e04116a8e7efb187",
      "bytes": 620
    },
    {
      "path": ".github/skills/impeccable/scripts/detector/browser/injected/index.mjs",